Enter password: *************
Welcome to the MySQL monitor.  Commands end with ; or \g.
Your MySQL connection id is 12
Server version: 8.0.46 MySQL Community Server - GPL

Copyright (c) 2000, 2026, Oracle and/or its affiliates.

Oracle is a registered trademark of Oracle Corporation and/or its
affiliates. Other names may be trademarks of their respective
owners.

Type 'help;' or '\h' for help. Type '\c' to clear the current input statement.

mysql> create database hospital;
ERROR 1007 (HY000): Can't create database 'hospital'; database exists
mysql> use hospital;
Database changed
mysql> CREATE TABLE patient (
    ->     Patient_ID INT PRIMARY KEY,
    ->     Name VARCHAR(100),
    ->     Age INT,
    ->     Gender VARCHAR(10),
    ->     Contact_Number VARCHAR(15),
    ->     Address VARCHAR(100)
    -> );
Query OK, 0 rows affected (0.07 sec)

mysql> CREATE TABLE doctor (
    ->     Doctor_ID INT PRIMARY KEY,
    ->     Name VARCHAR(100),
    ->     Specialization VARCHAR(50),
    ->     Treatment_Cost DECIMAL(10,2),
    ->     Doctor_Department VARCHAR(50),
    ->     Contact_Number VARCHAR(15)
    -> );
Query OK, 0 rows affected (0.02 sec)

mysql> insert into patient values(101,'Rahul Sharma',25,'Male','9876543210','Pune'),
    -> (102,'Priya Patil',32,'Female','9876501234','Mumbai'),
    -> (103,'Amit Kumar',45,'Male','9876512345','Kolhapur'),
    -> (104,'Sneha Joshi',29,'Female','9876523456','Satara'),
    -> (105,'Rohan Desai',38,'Male','9876534567','Sangli'),
    -> (106,'Anjali Kulkarni',27,'Female','9876545678','Nashik'),
    -> (107,'Vikram Singh',50,'Male','9876556789','Nagpur'),
    -> (108,'Neha Verma',34,'Female','9876567890','Solapur'),
    -> (109,'Karan Mehta',41,'Male','9876578901','Aurangabad'),
    -> (110,'Pooja More',31,'Female','9876589012','Ahmednagar');
Query OK, 10 rows affected (0.02 sec)
Records: 10  Duplicates: 0  Warnings: 0

mysql> INSERT INTO doctor
    -> VALUES
    -> (201,'Dr. Sharma','Cardiology',5000.00,'Heart','9876600001'),
    -> (202,'Dr. Mehta','Orthopedic',3500.00,'Bone','9876600002'),
    -> (203,'Dr. Patil','Neurology',6500.00,'Brain','9876600003'),
    -> (204,'Dr. Joshi','Dermatology',2500.00,'Skin','9876600004'),
    -> (205,'Dr. Kulkarni','Cardiology',5500.00,'Heart','9876600005'),
    -> (206,'Dr. Deshmukh','Pediatrics',3000.00,'Children','9876600006'),
    -> (207,'Dr. Shah','ENT',2800.00,'ENT','9876600007'),
    -> (208,'Dr. Reddy','General Medicine',2000.00,'Medicine','9876600008');
Query OK, 8 rows affected (0.01 sec)
Records: 8  Duplicates: 0  Warnings: 0

mysql> select * from patient;
+------------+-----------------+------+--------+----------------+------------+
| Patient_ID | Name            | Age  | Gender | Contact_Number | Address    |
+------------+-----------------+------+--------+----------------+------------+
|        101 | Rahul Sharma    |   25 | Male   | 9876543210     | Pune       |
|        102 | Priya Patil     |   32 | Female | 9876501234     | Mumbai     |
|        103 | Amit Kumar      |   45 | Male   | 9876512345     | Kolhapur   |
|        104 | Sneha Joshi     |   29 | Female | 9876523456     | Satara     |
|        105 | Rohan Desai     |   38 | Male   | 9876534567     | Sangli     |
|        106 | Anjali Kulkarni |   27 | Female | 9876545678     | Nashik     |
|        107 | Vikram Singh    |   50 | Male   | 9876556789     | Nagpur     |
|        108 | Neha Verma      |   34 | Female | 9876567890     | Solapur    |
|        109 | Karan Mehta     |   41 | Male   | 9876578901     | Aurangabad |
|        110 | Pooja More      |   31 | Female | 9876589012     | Ahmednagar |
+------------+-----------------+------+--------+----------------+------------+
10 rows in set (0.01 sec)

mysql> select * from doctor;
+-----------+--------------+------------------+----------------+-------------------+----------------+
| Doctor_ID | Name         | Specialization   | Treatment_Cost | Doctor_Department | Contact_Number |
+-----------+--------------+------------------+----------------+-------------------+----------------+
|       201 | Dr. Sharma   | Cardiology       |        5000.00 | Heart             | 9876600001     |
|       202 | Dr. Mehta    | Orthopedic       |        3500.00 | Bone              | 9876600002     |
|       203 | Dr. Patil    | Neurology        |        6500.00 | Brain             | 9876600003     |
|       204 | Dr. Joshi    | Dermatology      |        2500.00 | Skin              | 9876600004     |
|       205 | Dr. Kulkarni | Cardiology       |        5500.00 | Heart             | 9876600005     |
|       206 | Dr. Deshmukh | Pediatrics       |        3000.00 | Children          | 9876600006     |
|       207 | Dr. Shah     | ENT              |        2800.00 | ENT               | 9876600007     |
|       208 | Dr. Reddy    | General Medicine |        2000.00 | Medicine          | 9876600008     |
+-----------+--------------+------------------+----------------+-------------------+----------------+
8 rows in set (0.00 sec)

mysql> delete from patient where Patient_ID="109";
Query OK, 1 row affected (0.02 sec)

mysql> select * from patient;
+------------+-----------------+------+--------+----------------+------------+
| Patient_ID | Name            | Age  | Gender | Contact_Number | Address    |
+------------+-----------------+------+--------+----------------+------------+
|        101 | Rahul Sharma    |   25 | Male   | 9876543210     | Pune       |
|        102 | Priya Patil     |   32 | Female | 9876501234     | Mumbai     |
|        103 | Amit Kumar      |   45 | Male   | 9876512345     | Kolhapur   |
|        104 | Sneha Joshi     |   29 | Female | 9876523456     | Satara     |
|        105 | Rohan Desai     |   38 | Male   | 9876534567     | Sangli     |
|        106 | Anjali Kulkarni |   27 | Female | 9876545678     | Nashik     |
|        107 | Vikram Singh    |   50 | Male   | 9876556789     | Nagpur     |
|        108 | Neha Verma      |   34 | Female | 9876567890     | Solapur    |
|        110 | Pooja More      |   31 | Female | 9876589012     | Ahmednagar |
+------------+-----------------+------+--------+----------------+------------+
9 rows in set (0.01 sec)

mysql> select * from patient order by age desc;
+------------+-----------------+------+--------+----------------+------------+
| Patient_ID | Name            | Age  | Gender | Contact_Number | Address    |
+------------+-----------------+------+--------+----------------+------------+
|        107 | Vikram Singh    |   50 | Male   | 9876556789     | Nagpur     |
|        103 | Amit Kumar      |   45 | Male   | 9876512345     | Kolhapur   |
|        105 | Rohan Desai     |   38 | Male   | 9876534567     | Sangli     |
|        108 | Neha Verma      |   34 | Female | 9876567890     | Solapur    |
|        102 | Priya Patil     |   32 | Female | 9876501234     | Mumbai     |
|        110 | Pooja More      |   31 | Female | 9876589012     | Ahmednagar |
|        104 | Sneha Joshi     |   29 | Female | 9876523456     | Satara     |
|        106 | Anjali Kulkarni |   27 | Female | 9876545678     | Nashik     |
|        101 | Rahul Sharma    |   25 | Male   | 9876543210     | Pune       |
+------------+-----------------+------+--------+----------------+------------+
9 rows in set (0.00 sec)

mysql> update patient set Contact_Number="9999999999" where Patient_ID="103";
Query OK, 1 row affected (0.02 sec)
Rows matched: 1  Changed: 1  Warnings: 0

mysql> select * fromm patient;
ERROR 1064 (42000): You have an error in your SQL syntax; check the manual that corresponds to your MySQL server version for the right syntax to use near 'fromm patient' at line 1
mysql> select * from patient;
+------------+-----------------+------+--------+----------------+------------+
| Patient_ID | Name            | Age  | Gender | Contact_Number | Address    |
+------------+-----------------+------+--------+----------------+------------+
|        101 | Rahul Sharma    |   25 | Male   | 9876543210     | Pune       |
|        102 | Priya Patil     |   32 | Female | 9876501234     | Mumbai     |
|        103 | Amit Kumar      |   45 | Male   | 9999999999     | Kolhapur   |
|        104 | Sneha Joshi     |   29 | Female | 9876523456     | Satara     |
|        105 | Rohan Desai     |   38 | Male   | 9876534567     | Sangli     |
|        106 | Anjali Kulkarni |   27 | Female | 9876545678     | Nashik     |
|        107 | Vikram Singh    |   50 | Male   | 9876556789     | Nagpur     |
|        108 | Neha Verma      |   34 | Female | 9876567890     | Solapur    |
|        110 | Pooja More      |   31 | Female | 9876589012     | Ahmednagar |
+------------+-----------------+------+--------+----------------+------------+
9 rows in set (0.00 sec)

mysql> select Specialization from doctor;
+------------------+
| Specialization   |
+------------------+
| Cardiology       |
| Orthopedic       |
| Neurology        |
| Dermatology      |
| Cardiology       |
| Pediatrics       |
| ENT              |
| General Medicine |
+------------------+
8 rows in set (0.00 sec)

mysql> UPDATE patient
    -> SET Address='Nagpur',
    ->     Contact_Number='8888888888'
    -> WHERE Patient_ID=102;
Query OK, 1 row affected (0.01 sec)
Rows matched: 1  Changed: 1  Warnings: 0

mysql> select * from patient;
+------------+-----------------+------+--------+----------------+------------+
| Patient_ID | Name            | Age  | Gender | Contact_Number | Address    |
+------------+-----------------+------+--------+----------------+------------+
|        101 | Rahul Sharma    |   25 | Male   | 9876543210     | Pune       |
|        102 | Priya Patil     |   32 | Female | 8888888888     | Nagpur     |
|        103 | Amit Kumar      |   45 | Male   | 9999999999     | Kolhapur   |
|        104 | Sneha Joshi     |   29 | Female | 9876523456     | Satara     |
|        105 | Rohan Desai     |   38 | Male   | 9876534567     | Sangli     |
|        106 | Anjali Kulkarni |   27 | Female | 9876545678     | Nashik     |
|        107 | Vikram Singh    |   50 | Male   | 9876556789     | Nagpur     |
|        108 | Neha Verma      |   34 | Female | 9876567890     | Solapur    |
|        110 | Pooja More      |   31 | Female | 9876589012     | Ahmednagar |
+------------+-----------------+------+--------+----------------+------------+
9 rows in set (0.00 sec)

mysql> update doctor set Treatment_Cost=Treatment_Cost + 100 where Specialization='ENT';
Query OK, 1 row affected (0.02 sec)
Rows matched: 1  Changed: 1  Warnings: 0

mysql> select * doctor;
ERROR 1064 (42000): You have an error in your SQL syntax; check the manual that corresponds to your MySQL server version for the right syntax to use near 'doctor' at line 1
mysql> select * from doctor;
+-----------+--------------+------------------+----------------+-------------------+----------------+
| Doctor_ID | Name         | Specialization   | Treatment_Cost | Doctor_Department | Contact_Number |
+-----------+--------------+------------------+----------------+-------------------+----------------+
|       201 | Dr. Sharma   | Cardiology       |        5000.00 | Heart             | 9876600001     |
|       202 | Dr. Mehta    | Orthopedic       |        3500.00 | Bone              | 9876600002     |
|       203 | Dr. Patil    | Neurology        |        6500.00 | Brain             | 9876600003     |
|       204 | Dr. Joshi    | Dermatology      |        2500.00 | Skin              | 9876600004     |
|       205 | Dr. Kulkarni | Cardiology       |        5500.00 | Heart             | 9876600005     |
|       206 | Dr. Deshmukh | Pediatrics       |        3000.00 | Children          | 9876600006     |
|       207 | Dr. Shah     | ENT              |        2900.00 | ENT               | 9876600007     |
|       208 | Dr. Reddy    | General Medicine |        2000.00 | Medicine          | 9876600008     |
+-----------+--------------+------------------+----------------+-------------------+----------------+
8 rows in set (0.00 sec)

mysql> ALTER TABLE patient
    -> ADD Date_Admitted DATE;
Query OK, 0 rows affected (0.03 sec)
Records: 0  Duplicates: 0  Warnings: 0

mysql> select * from doctor;
+-----------+--------------+------------------+----------------+-------------------+----------------+
| Doctor_ID | Name         | Specialization   | Treatment_Cost | Doctor_Department | Contact_Number |
+-----------+--------------+------------------+----------------+-------------------+----------------+
|       201 | Dr. Sharma   | Cardiology       |        5000.00 | Heart             | 9876600001     |
|       202 | Dr. Mehta    | Orthopedic       |        3500.00 | Bone              | 9876600002     |
|       203 | Dr. Patil    | Neurology        |        6500.00 | Brain             | 9876600003     |
|       204 | Dr. Joshi    | Dermatology      |        2500.00 | Skin              | 9876600004     |
|       205 | Dr. Kulkarni | Cardiology       |        5500.00 | Heart             | 9876600005     |
|       206 | Dr. Deshmukh | Pediatrics       |        3000.00 | Children          | 9876600006     |
|       207 | Dr. Shah     | ENT              |        2900.00 | ENT               | 9876600007     |
|       208 | Dr. Reddy    | General Medicine |        2000.00 | Medicine          | 9876600008     |
+-----------+--------------+------------------+----------------+-------------------+----------------+
8 rows in set (0.00 sec)

mysql> select * from patient;
+------------+-----------------+------+--------+----------------+------------+---------------+
| Patient_ID | Name            | Age  | Gender | Contact_Number | Address    | Date_Admitted |
+------------+-----------------+------+--------+----------------+------------+---------------+
|        101 | Rahul Sharma    |   25 | Male   | 9876543210     | Pune       | NULL          |
|        102 | Priya Patil     |   32 | Female | 8888888888     | Nagpur     | NULL          |
|        103 | Amit Kumar      |   45 | Male   | 9999999999     | Kolhapur   | NULL          |
|        104 | Sneha Joshi     |   29 | Female | 9876523456     | Satara     | NULL          |
|        105 | Rohan Desai     |   38 | Male   | 9876534567     | Sangli     | NULL          |
|        106 | Anjali Kulkarni |   27 | Female | 9876545678     | Nashik     | NULL          |
|        107 | Vikram Singh    |   50 | Male   | 9876556789     | Nagpur     | NULL          |
|        108 | Neha Verma      |   34 | Female | 9876567890     | Solapur    | NULL          |
|        110 | Pooja More      |   31 | Female | 9876589012     | Ahmednagar | NULL          |
+------------+-----------------+------+--------+----------------+------------+---------------+
9 rows in set (0.00 sec)

mysql> UPDATE patient SET Date_Admitted='2026-07-01' WHERE Patient_ID=101;
Query OK, 1 row affected (0.01 sec)
Rows matched: 1  Changed: 1  Warnings: 0

mysql> UPDATE patient SET Date_Admitted='2026-07-03' WHERE Patient_ID=102;
Query OK, 1 row affected (0.00 sec)
Rows matched: 1  Changed: 1  Warnings: 0

mysql> UPDATE patient SET Date_Admitted='2026-07-05' WHERE Patient_ID=103;
Query OK, 1 row affected (0.00 sec)
Rows matched: 1  Changed: 1  Warnings: 0

mysql> UPDATE patient SET Date_Admitted='2026-07-08' WHERE Patient_ID=104;
Query OK, 1 row affected (0.00 sec)
Rows matched: 1  Changed: 1  Warnings: 0

mysql> UPDATE patient SET Date_Admitted='2026-07-10' WHERE Patient_ID=105;
Query OK, 1 row affected (0.00 sec)
Rows matched: 1  Changed: 1  Warnings: 0

mysql> UPDATE patient SET Date_Admitted='2026-07-12' WHERE Patient_ID=106;
Query OK, 1 row affected (0.00 sec)
Rows matched: 1  Changed: 1  Warnings: 0

mysql> UPDATE patient SET Date_Admitted='2026-07-15' WHERE Patient_ID=107;
Query OK, 1 row affected (0.00 sec)
Rows matched: 1  Changed: 1  Warnings: 0

mysql> UPDATE patient SET Date_Admitted='2026-07-18' WHERE Patient_ID=108;
Query OK, 1 row affected (0.01 sec)
Rows matched: 1  Changed: 1  Warnings: 0

mysql> UPDATE patient SET Date_Admitted='2026-07-22' WHERE Patient_ID=110;
Query OK, 1 row affected (0.00 sec)
Rows matched: 1  Changed: 1  Warnings: 0

mysql> select * from patient;
+------------+-----------------+------+--------+----------------+------------+---------------+
| Patient_ID | Name            | Age  | Gender | Contact_Number | Address    | Date_Admitted |
+------------+-----------------+------+--------+----------------+------------+---------------+
|        101 | Rahul Sharma    |   25 | Male   | 9876543210     | Pune       | 2026-07-01    |
|        102 | Priya Patil     |   32 | Female | 8888888888     | Nagpur     | 2026-07-03    |
|        103 | Amit Kumar      |   45 | Male   | 9999999999     | Kolhapur   | 2026-07-05    |
|        104 | Sneha Joshi     |   29 | Female | 9876523456     | Satara     | 2026-07-08    |
|        105 | Rohan Desai     |   38 | Male   | 9876534567     | Sangli     | 2026-07-10    |
|        106 | Anjali Kulkarni |   27 | Female | 9876545678     | Nashik     | 2026-07-12    |
|        107 | Vikram Singh    |   50 | Male   | 9876556789     | Nagpur     | 2026-07-15    |
|        108 | Neha Verma      |   34 | Female | 9876567890     | Solapur    | 2026-07-18    |
|        110 | Pooja More      |   31 | Female | 9876589012     | Ahmednagar | 2026-07-22    |
+------------+-----------------+------+--------+----------------+------------+---------------+
9 rows in set (0.00 sec)

mysql> ALTER TABLE doctor
    -> ADD Appointment_Time TIME;
Query OK, 0 rows affected (0.03 sec)
Records: 0  Duplicates: 0  Warnings: 0

mysql> UPDATE doctor SET Appointment_Time='09:00:00' WHERE Doctor_ID=201;
Query OK, 1 row affected (0.01 sec)
Rows matched: 1  Changed: 1  Warnings: 0

mysql> UPDATE doctor SET Appointment_Time='09:30:00' WHERE Doctor_ID=202;
Query OK, 1 row affected (0.00 sec)
Rows matched: 1  Changed: 1  Warnings: 0

mysql> UPDATE doctor SET Appointment_Time='10:00:00' WHERE Doctor_ID=203;
Query OK, 1 row affected (0.00 sec)
Rows matched: 1  Changed: 1  Warnings: 0

mysql> UPDATE doctor SET Appointment_Time='10:30:00' WHERE Doctor_ID=204;
Query OK, 1 row affected (0.00 sec)
Rows matched: 1  Changed: 1  Warnings: 0

mysql> UPDATE doctor SET Appointment_Time='11:00:00' WHERE Doctor_ID=205;
Query OK, 1 row affected (0.00 sec)
Rows matched: 1  Changed: 1  Warnings: 0

mysql> UPDATE doctor SET Appointment_Time='11:30:00' WHERE Doctor_ID=206;
Query OK, 1 row affected (0.00 sec)
Rows matched: 1  Changed: 1  Warnings: 0

mysql> UPDATE doctor SET Appointment_Time='12:00:00' WHERE Doctor_ID=207;
Query OK, 1 row affected (0.01 sec)
Rows matched: 1  Changed: 1  Warnings: 0

mysql> UPDATE doctor SET Appointment_Time='12:30:00' WHERE Doctor_ID=208;
Query OK, 1 row affected (0.01 sec)
Rows matched: 1  Changed: 1  Warnings: 0

mysql> select * from doctor;
+-----------+--------------+------------------+----------------+-------------------+----------------+------------------+
| Doctor_ID | Name         | Specialization   | Treatment_Cost | Doctor_Department | Contact_Number | Appointment_Time |
+-----------+--------------+------------------+----------------+-------------------+----------------+------------------+
|       201 | Dr. Sharma   | Cardiology       |        5000.00 | Heart             | 9876600001     | 09:00:00         |
|       202 | Dr. Mehta    | Orthopedic       |        3500.00 | Bone              | 9876600002     | 09:30:00         |
|       203 | Dr. Patil    | Neurology        |        6500.00 | Brain             | 9876600003     | 10:00:00         |
|       204 | Dr. Joshi    | Dermatology      |        2500.00 | Skin              | 9876600004     | 10:30:00         |
|       205 | Dr. Kulkarni | Cardiology       |        5500.00 | Heart             | 9876600005     | 11:00:00         |
|       206 | Dr. Deshmukh | Pediatrics       |        3000.00 | Children          | 9876600006     | 11:30:00         |
|       207 | Dr. Shah     | ENT              |        2900.00 | ENT               | 9876600007     | 12:00:00         |
|       208 | Dr. Reddy    | General Medicine |        2000.00 | Medicine          | 9876600008     | 12:30:00         |
+-----------+--------------+------------------+----------------+-------------------+----------------+------------------+
8 rows in set (0.00 sec)

mysql> alter table patient MODIFY Contact_Number VARCHAR(20);
Query OK, 0 rows affected (0.03 sec)
Records: 0  Duplicates: 0  Warnings: 0

mysql> select * from patient;
+------------+-----------------+------+--------+----------------+------------+---------------+
| Patient_ID | Name            | Age  | Gender | Contact_Number | Address    | Date_Admitted |
+------------+-----------------+------+--------+----------------+------------+---------------+
|        101 | Rahul Sharma    |   25 | Male   | 9876543210     | Pune       | 2026-07-01    |
|        102 | Priya Patil     |   32 | Female | 8888888888     | Nagpur     | 2026-07-03    |
|        103 | Amit Kumar      |   45 | Male   | 9999999999     | Kolhapur   | 2026-07-05    |
|        104 | Sneha Joshi     |   29 | Female | 9876523456     | Satara     | 2026-07-08    |
|        105 | Rohan Desai     |   38 | Male   | 9876534567     | Sangli     | 2026-07-10    |
|        106 | Anjali Kulkarni |   27 | Female | 9876545678     | Nashik     | 2026-07-12    |
|        107 | Vikram Singh    |   50 | Male   | 9876556789     | Nagpur     | 2026-07-15    |
|        108 | Neha Verma      |   34 | Female | 9876567890     | Solapur    | 2026-07-18    |
|        110 | Pooja More      |   31 | Female | 9876589012     | Ahmednagar | 2026-07-22    |
+------------+-----------------+------+--------+----------------+------------+---------------+
9 rows in set (0.00 sec)

mysql> select * from patient where age > 30;
+------------+--------------+------+--------+----------------+------------+---------------+
| Patient_ID | Name         | Age  | Gender | Contact_Number | Address    | Date_Admitted |
+------------+--------------+------+--------+----------------+------------+---------------+
|        102 | Priya Patil  |   32 | Female | 8888888888     | Nagpur     | 2026-07-03    |
|        103 | Amit Kumar   |   45 | Male   | 9999999999     | Kolhapur   | 2026-07-05    |
|        105 | Rohan Desai  |   38 | Male   | 9876534567     | Sangli     | 2026-07-10    |
|        107 | Vikram Singh |   50 | Male   | 9876556789     | Nagpur     | 2026-07-15    |
|        108 | Neha Verma   |   34 | Female | 9876567890     | Solapur    | 2026-07-18    |
|        110 | Pooja More   |   31 | Female | 9876589012     | Ahmednagar | 2026-07-22    |
+------------+--------------+------+--------+----------------+------------+---------------+
6 rows in set (0.01 sec)

mysql> select max(Treatment_Cost) from doctor;
+---------------------+
| max(Treatment_Cost) |
+---------------------+
|             6500.00 |
+---------------------+
1 row in set (0.02 sec)

mysql> SELECT *
    -> FROM patient
    -> ORDER BY Age DESC;
+------------+-----------------+------+--------+----------------+------------+---------------+
| Patient_ID | Name            | Age  | Gender | Contact_Number | Address    | Date_Admitted |
+------------+-----------------+------+--------+----------------+------------+---------------+
|        107 | Vikram Singh    |   50 | Male   | 9876556789     | Nagpur     | 2026-07-15    |
|        103 | Amit Kumar      |   45 | Male   | 9999999999     | Kolhapur   | 2026-07-05    |
|        105 | Rohan Desai     |   38 | Male   | 9876534567     | Sangli     | 2026-07-10    |
|        108 | Neha Verma      |   34 | Female | 9876567890     | Solapur    | 2026-07-18    |
|        102 | Priya Patil     |   32 | Female | 8888888888     | Nagpur     | 2026-07-03    |
|        110 | Pooja More      |   31 | Female | 9876589012     | Ahmednagar | 2026-07-22    |
|        104 | Sneha Joshi     |   29 | Female | 9876523456     | Satara     | 2026-07-08    |
|        106 | Anjali Kulkarni |   27 | Female | 9876545678     | Nashik     | 2026-07-12    |
|        101 | Rahul Sharma    |   25 | Male   | 9876543210     | Pune       | 2026-07-01    |
+------------+-----------------+------+--------+----------------+------------+---------------+
9 rows in set (0.00 sec)

mysql>
